"Authors","Author full names","Author(s) ID","Title","Year","Source title","Volume","Issue","Art. No.","Page start","Page end","Page count","Cited by","DOI","Link","Document Type","Publication Stage","Open Access","Source","EID"
"Du Q.; Huang H.","Du, Qi (57196438063); Huang, Hui (57218685700)","57196438063; 57218685700","MPI parameter optimization during debugging phase of HPC system","2022","Journal of Supercomputing","78","2","","1696","1711","15","1","10.1007/s11227-021-03939-6","https://www.scopus.com/inward/record.uri?eid=2-s2.0-85108159129&doi=10.1007%2fs11227-021-03939-6&partnerID=40&md5=11a208a6e4aa5762c4b334a1904fb8a3","Article","Final","","Scopus","2-s2.0-85108159129"
"Fernandes S.","Fernandes, Sara (35329707600)","35329707600","A live environment for inspection and refactoring of software systems","2021","ESEC/FSE 2021 - Proceedings of the 29th ACM Joint Meeting European Software Engineering Conference and Symposium on the Foundations of Software Engineering","","","","1655","1659","4","3","10.1145/3468264.3473100","https://www.scopus.com/inward/record.uri?eid=2-s2.0-85116297018&doi=10.1145%2f3468264.3473100&partnerID=40&md5=20c1ae83ad3d2be9e6522d78cdb58c2b","Conference paper","Final","All Open Access; Bronze Open Access","Scopus","2-s2.0-85116297018"
"Brownlee A.E.I.; Epitropakis M.G.; Mulder J.; Paelinck M.; Burke E.K.","Brownlee, Alexander E. I. (19638592200); Epitropakis, Michael G. (23974364200); Mulder, Jeroen (15837390100); Paelinck, Marc (26635773300); Burke, Edmund K. (7202857377)","19638592200; 23974364200; 15837390100; 26635773300; 7202857377","A systematic approach to parameter optimization and its application to flight schedule simulation software","2022","Journal of Heuristics","28","4","","509","538","29","2","10.1007/s10732-022-09501-8","https://www.scopus.com/inward/record.uri?eid=2-s2.0-85133428509&doi=10.1007%2fs10732-022-09501-8&partnerID=40&md5=07800f086ba78a4cf8ebe6ebb4baacbe","Article","Final","All Open Access; Green Open Access; Hybrid Gold Open Access","Scopus","2-s2.0-85133428509"
"Swain V.K.; Panigrahi R.; Sahu K.K.; Padhy N.","Swain, Vishal Kumar (58995731400); Panigrahi, Rasmita (56417995400); Sahu, Kiran Kumar (58996293200); Padhy, Neelamadhab (56417506600)","58995731400; 56417995400; 58996293200; 56417506600","Revealing MOVE METHOD: Machine Learning-driven Real-time Refactoring Identification for Enhanced Software Quality","2024","ESIC 2024 - 4th International Conference on Emerging Systems and Intelligent Computing, Proceedings","","","","572","578","6","0","10.1109/ESIC60604.2024.10481609","https://www.scopus.com/inward/record.uri?eid=2-s2.0-85190959287&doi=10.1109%2fESIC60604.2024.10481609&partnerID=40&md5=3c4dcb4ef1c4034aefeff9f8a771f35b","Conference paper","Final","","Scopus","2-s2.0-85190959287"
"Parasyris K.; Georgakoudis G.; Rangel E.; Laguna I.; Doerfert J.","Parasyris, Konstantinos (56429564000); Georgakoudis, Giorgis (35194054800); Rangel, Esteban (57189616874); Laguna, Ignacio (24468332500); Doerfert, Johannes (55831758900)","56429564000; 35194054800; 57189616874; 24468332500; 55831758900","Scalable Tuning of (OpenMP) GPU Applications via Kernel Record and Replay","2023","Proceedings of the International Conference for High Performance Computing, Networking, Storage and Analysis, SC 2023","","","28","","","","0","10.1145/3581784.3607098","https://www.scopus.com/inward/record.uri?eid=2-s2.0-85179556539&doi=10.1145%2f3581784.3607098&partnerID=40&md5=fc2f8c0bb7b13a0a36e777835a8d7681","Conference paper","Final","All Open Access; Green Open Access; Hybrid Gold Open Access","Scopus","2-s2.0-85179556539"
"Fernandes S.; Aguiar A.; Restivo A.","Fernandes, Sara (35329707600); Aguiar, Ademar (35753041400); Restivo, André (26531800800)","35329707600; 35753041400; 26531800800","The Impact of a Live Refactoring Environment on Software Development","2024","Proceedings - International Conference on Software Engineering","","","","337","338","1","0","10.1145/3639478.3643100","https://www.scopus.com/inward/record.uri?eid=2-s2.0-85194859369&doi=10.1145%2f3639478.3643100&partnerID=40&md5=44a2cb843b0a4843fc4dedb0b2b03b19","Conference paper","Final","All Open Access; Hybrid Gold Open Access","Scopus","2-s2.0-85194859369"
"Malathi S.","Malathi, S. (57195331995)","57195331995","Model for refactoring a software using feature oriented dependency (FOD)","2021","Advances in Parallel Computing","39","","","315","319","4","0","10.3233/APC210154","https://www.scopus.com/inward/record.uri?eid=2-s2.0-85119828192&doi=10.3233%2fAPC210154&partnerID=40&md5=a7d734b1f0c018303df05f8bf633c230","Article","Final","All Open Access; Gold Open Access","Scopus","2-s2.0-85119828192"
"Hohenstein U.; Mahabaleswar M.; Shumaiev K.; Schroff D.","Hohenstein, Uwe (6602475849); Mahabaleswar, Manoj (58679036600); Shumaiev, Klym (56204189600); Schroff, Denis (58679809600)","6602475849; 58679036600; 56204189600; 58679809600","A Flexible Approach for Solving Quality Issues by Means of Collecting Runtime Data","2023","Proceedings - 2023 International Conference on Software and System Engineering, ICoSSE 2023","","","","30","37","7","0","10.1109/ICoSSE58936.2023.00014","https://www.scopus.com/inward/record.uri?eid=2-s2.0-85175634732&doi=10.1109%2fICoSSE58936.2023.00014&partnerID=40&md5=72667ceb2d8e35915ff9ff0d32f19386","Conference paper","Final","","Scopus","2-s2.0-85175634732"
"Wood C.; Georgakoudis G.; Beckingsale D.; Poliakoff D.; Gimenez A.; Huck K.; Malony A.; Gamblin T.","Wood, Chad (57193442559); Georgakoudis, Giorgis (35194054800); Beckingsale, David (55580348600); Poliakoff, David (57191243813); Gimenez, Alfredo (23102747900); Huck, Kevin (14016054200); Malony, Allen (7004220494); Gamblin, Todd (24766361700)","57193442559; 35194054800; 55580348600; 57191243813; 23102747900; 14016054200; 7004220494; 24766361700","Artemis: Automatic Runtime Tuning of Parallel Execution Parameters Using Machine Learning","2021","Lecture Notes in Computer Science (including subseries Lecture Notes in Artificial Intelligence and Lecture Notes in Bioinformatics)","12728 LNCS","","","453","472","19","4","10.1007/978-3-030-78713-4_24","https://www.scopus.com/inward/record.uri?eid=2-s2.0-85111411977&doi=10.1007%2f978-3-030-78713-4_24&partnerID=40&md5=6ab2f8fdf9a54d4ec1b8dea7ee8c6392","Conference paper","Final","All Open Access; Green Open Access","Scopus","2-s2.0-85111411977"
"Janjic V.; Brown C.; Barwell A.; Hammond K.","Janjic, Vladimir (55508348400); Brown, Christopher (55547126743); Barwell, Adam (56369061700); Hammond, Kevin (22734011200)","55508348400; 55547126743; 56369061700; 22734011200","Refactoring for introducing and tuning parallelism for heterogeneous multicore machines in Erlang","2021","Concurrency and Computation: Practice and Experience","33","14","e5420","","","","0","10.1002/cpe.5420","https://www.scopus.com/inward/record.uri?eid=2-s2.0-85068082266&doi=10.1002%2fcpe.5420&partnerID=40&md5=02c8ed0ef943ec1bfe038e54afd1c822","Conference paper","Final","All Open Access; Green Open Access","Scopus","2-s2.0-85068082266"
"Dutta A.; Alcaraz J.; Tehranijamsaz A.; Sikora A.; Cesar E.; Jannesari A.","Dutta, Akash (57546677500); Alcaraz, Jordi (57204187910); Tehranijamsaz, Ali (57223294107); Sikora, Anna (58257636800); Cesar, Eduardo (6701808810); Jannesari, Ali (25825073200)","57546677500; 57204187910; 57223294107; 58257636800; 6701808810; 25825073200","Pattern-based Autotuning of OpenMP Loops using Graph Neural Networks","2022","Proceedings of AI4S 2022: Artificial Intelligence and Machine Learning for Scientific Applications, Held in conjunction with SC 2022: The International Conference for High Performance Computing, Networking, Storage and Analysis","","","","26","31","5","3","10.1109/AI4S56813.2022.00010","https://www.scopus.com/inward/record.uri?eid=2-s2.0-85147957414&doi=10.1109%2fAI4S56813.2022.00010&partnerID=40&md5=d69b2eebe8b438d84a666418efa55b7c","Conference paper","Final","","Scopus","2-s2.0-85147957414"
"Traini L.; Di Pompeo D.; Tucci M.; Lin B.; Scalabrino S.; Bavota G.; Lanza M.; Oliveto R.; Cortellessa V.","Traini, Luca (57201399696); Di Pompeo, Daniele (57188727238); Tucci, Michele (55317706000); Lin, Bin (57195074521); Scalabrino, Simone (57190400149); Bavota, Gabriele (57220148228); Lanza, Michele (56760055000); Oliveto, Rocco (15136561900); Cortellessa, Vittorio (6603764364)","57201399696; 57188727238; 55317706000; 57195074521; 57190400149; 57220148228; 56760055000; 15136561900; 6603764364","How Software Refactoring Impacts Execution Time","2022","ACM Transactions on Software Engineering and Methodology","31","2","25","","","","12","10.1145/3485136","https://www.scopus.com/inward/record.uri?eid=2-s2.0-85130721100&doi=10.1145%2f3485136&partnerID=40&md5=f9a34a6c34f1e01727e0e5282eebc127","Article","Final","","Scopus","2-s2.0-85130721100"
"Fernandes S.; Aguiar A.; Restivo A.","Fernandes, Sara (35329707600); Aguiar, Ademar (35753041400); Restivo, André (26531800800)","35329707600; 35753041400; 26531800800","A Live Environment to Improve the Refactoring Experience","2022","ACM International Conference Proceeding Series","","","","30","37","7","2","10.1145/3532512.3535222","https://www.scopus.com/inward/record.uri?eid=2-s2.0-85144247826&doi=10.1145%2f3532512.3535222&partnerID=40&md5=e23c099a0644ef3cac5d7b98721f4db5","Conference paper","Final","All Open Access; Bronze Open Access","Scopus","2-s2.0-85144247826"
"Menshawy R.S.; Yousef A.H.; Salem A.","Menshawy, Rana S. (57226381728); Yousef, Ahmed H. (57217371978); Salem, Ashraf (8717709900)","57226381728; 57217371978; 8717709900","Code Smells and Detection Techniques: A Survey","2021","2021 International Mobile, Intelligent, and Ubiquitous Computing Conference, MIUCC 2021","","","9447669","78","83","5","12","10.1109/MIUCC52538.2021.9447669","https://www.scopus.com/inward/record.uri?eid=2-s2.0-85111388772&doi=10.1109%2fMIUCC52538.2021.9447669&partnerID=40&md5=d050d0c69812f8ba42c16b35381aa7f2","Conference paper","Final","","Scopus","2-s2.0-85111388772"
"Parasyris K.; Georgakoudis G.; Rangel E.; Laguna I.; Doerfert J.","Parasyris, Konstantinos (56429564000); Georgakoudis, Giorgis (35194054800); Rangel, Esteban (57189616874); Laguna, Ignacio (24468332500); Doerfert, Johannes (55831758900)","56429564000; 35194054800; 57189616874; 24468332500; 55831758900","Scalable Tuning of (OpenMP) GPU Applications via Kernel Record and Replay","2023","International Conference for High Performance Computing, Networking, Storage and Analysis, SC","","","","","","","0","10.1145/3581784.3607098","https://www.scopus.com/inward/record.uri?eid=2-s2.0-85190439928&doi=10.1145%2f3581784.3607098&partnerID=40&md5=8d8dfcc0f6100ec066d2ca231dbe3bf3","Conference paper","Final","All Open Access; Hybrid Gold Open Access","Scopus","2-s2.0-85190439928"
"Şanlıalp İ.; Öztürk M.M.; Yiğit T.","Şanlıalp, İbrahim (57216412166); Öztürk, Muhammed Maruf (55387379400); Yiğit, Tuncay (57223411924)","57216412166; 55387379400; 57223411924","Energy Efficiency Analysis of Code Refactoring Techniques for Green and Sustainable Software in Portable Devices","2022","Electronics (Switzerland)","11","3","442","","","","10","10.3390/electronics11030442","https://www.scopus.com/inward/record.uri?eid=2-s2.0-85123696731&doi=10.3390%2felectronics11030442&partnerID=40&md5=8fe011f33af431035e57ce272701b1b4","Article","Final","All Open Access; Gold Open Access","Scopus","2-s2.0-85123696731"
"Ni A.; Ramos D.; Yang A.Z.H.; Lynce I.; Manquinho V.; Martins R.; Le Goues C.","Ni, Ansong (57222262354); Ramos, Daniel (57221469434); Yang, Aidan Z. H. (57211035225); Lynce, Ines (6603143167); Manquinho, Vasco (6507501441); Martins, Ruben (59157733800); Le Goues, Claire (35113323900)","57222262354; 57221469434; 57211035225; 6603143167; 6507501441; 59157733800; 35113323900","SOAR: A synthesis approach for data science API refactoring","2021","Proceedings - International Conference on Software Engineering","","","","112","124","12","15","10.1109/ICSE43902.2021.00023","https://www.scopus.com/inward/record.uri?eid=2-s2.0-85159748861&doi=10.1109%2fICSE43902.2021.00023&partnerID=40&md5=2d7f67f463bdd282b791f9229619b552","Conference paper","Final","All Open Access; Green Open Access","Scopus","2-s2.0-85159748861"
"Zhou S.; Jiang Z.; Li S.; Liu X.; Jia Z.; Zhang Y.; Ma J.; Mi H.","Zhou, Shulin (57190581161); Jiang, Zhijie (57216621961); Li, Shanshan (55741045700); Liu, Xiaodong (56733794300); Jia, Zhouyang (56733791600); Zhang, Yuanliang (57202613210); Ma, Jun (56873512900); Mi, Haibo (36509071500)","57190581161; 57216621961; 55741045700; 56733794300; 56733791600; 57202613210; 56873512900; 36509071500","WMWatcher: Preventing Workload-Related Misconfigurations in Production Environment","2023","Proceedings - Asia-Pacific Software Engineering Conference, APSEC","","","","279","288","9","0","10.1109/APSEC60848.2023.00038","https://www.scopus.com/inward/record.uri?eid=2-s2.0-85190526236&doi=10.1109%2fAPSEC60848.2023.00038&partnerID=40&md5=0ae172674f02e0471bcd562a10fa899a","Conference paper","Final","","Scopus","2-s2.0-85190526236"
"Brito A.; Hora A.; Valente M.T.","Brito, Aline (57194039093); Hora, Andre (55205116000); Valente, Marco Tulio (55437198000)","57194039093; 55205116000; 55437198000","Characterizing refactoring graphs in Java and JavaScript projects","2021","Empirical Software Engineering","26","6","125","","","","7","10.1007/s10664-021-10023-3","https://www.scopus.com/inward/record.uri?eid=2-s2.0-85115166417&doi=10.1007%2fs10664-021-10023-3&partnerID=40&md5=b5a5afde2cbb7ec8d45f36d4006af9d6","Article","Final","","Scopus","2-s2.0-85115166417"
"Khaleel S.I.; Al-Khatouni G.K.","Khaleel, Shahbaa I. (57221608822); Al-Khatouni, Ghassan Khaleel (58403934700)","57221608822; 58403934700","A literature review for measuring maintainability of code clone","2023","Indonesian Journal of Electrical Engineering and Computer Science","31","2","","1118","1127","9","0","10.11591/ijeecs.v31.i2.pp1118-1127","https://www.scopus.com/inward/record.uri?eid=2-s2.0-85163423385&doi=10.11591%2fijeecs.v31.i2.pp1118-1127&partnerID=40&md5=6c5d9de9162340eccbabae714f03784e","Article","Final","All Open Access; Gold Open Access; Green Open Access","Scopus","2-s2.0-85163423385"
